<?xml version="1.0" encoding="UTF-8"?>
<tns:Actividad xmlns:tns="http://www.example.org/actividad" xmlns:xsi="http://www.w3.org/2001/XMLSchema-instance" xsi:schemaLocation="http://www.example.org/actividad BookleSchema.xsd ">
  <tns:agenda>
    <tns:turno>
      <tns:horario>tns:horario</tns:horario>
    </tns:turno>
    <tns:fecha>2001-01-01</tns:fecha>
  </tns:agenda>
  <tns:id>tns:id</tns:id>
  <tns:titulo>tns:titulo</tns:titulo>
  <tns:profesor>tns:profesor</tns:profesor>
</tns:Actividad>
